{
  "contract": "hwm:WorldView",
  "contract_version": "0.1.0",
  "view_id": "urn:hwm:view:lifecycle-before-replacement",
  "household_id": "urn:hwm:household:fixture-003",
  "requester": "urn:hwm:subject:lifecycle-planner",
  "purpose": "hwm:purpose:reading",
  "generated_at": "2026-07-18T08:30:00Z",
  "as_of": "2026-07-18T08:30:00Z",
  "known_through": "2026-07-18T08:00:00Z",
  "freshness": { "maximum_age_seconds": 3600, "status": "current" },
  "coverage": {
    "entity_refs": [
      "urn:hwm:slot:lifecycle-reading-light",
      "urn:hwm:asset:lamp-old",
      "urn:hwm:endpoint:matter-lamp-old"
    ],
    "claim_kinds": ["rdf:type", "hwm-effect:minimumRequirement", "hwm-lifecycle:fulfills", "hwm-lifecycle:exposes", "hwm-effect:predictsOutcome"]
  },
  "authority_epoch": 4,
  "profiles": [
    { "id": "hwm:core", "version": "0.1.0", "required": true },
    { "id": "hwm:space-lifecycle", "version": "0.1.0-fixture", "required": true }
  ],
  "resolutions": [
    {
      "resolution_id": "urn:hwm:resolution:lifecycle-slot-before",
      "subject": "urn:hwm:slot:lifecycle-reading-light",
      "predicate": "rdf:type",
      "availability_status": "available",
      "epistemic_status": "accepted",
      "freshness_status": "not_applicable",
      "temporal_status": "unbounded",
      "candidates": [{
        "candidate_id": "urn:hwm:candidate:lifecycle-slot-before",
        "object": "hwm:FunctionalSlot",
        "claim_ids": ["urn:hwm:claim:lifecycle-slot-type"],
        "evidence_record_ids": ["urn:hwm:record:lifecycle-initial-declaration"],
        "extensions": {}
      }],
      "reason_codes": []
    },
    {
      "resolution_id": "urn:hwm:resolution:lifecycle-requirement-before",
      "subject": "urn:hwm:slot:lifecycle-reading-light",
      "predicate": "hwm-effect:minimumRequirement",
      "availability_status": "available",
      "epistemic_status": "accepted",
      "freshness_status": "current",
      "temporal_status": "unbounded",
      "candidates": [{
        "candidate_id": "urn:hwm:candidate:lifecycle-requirement-before",
        "object": {
          "affected_feature_id": "urn:hwm:zone:lifecycle-reading",
          "property": "saref:Light",
          "threshold": { "value": 300, "unit": "lx" },
          "comparator": ">="
        },
        "claim_ids": ["urn:hwm:claim:lifecycle-reading-requirement"],
        "evidence_record_ids": ["urn:hwm:record:lifecycle-initial-declaration"],
        "extensions": {}
      }],
      "reason_codes": []
    },
    {
      "resolution_id": "urn:hwm:resolution:old-fulfillment-before",
      "subject": "urn:hwm:asset:lamp-old",
      "predicate": "hwm-lifecycle:fulfills",
      "availability_status": "available",
      "epistemic_status": "accepted",
      "freshness_status": "current",
      "temporal_status": "in_effect",
      "candidates": [{
        "candidate_id": "urn:hwm:candidate:old-fulfillment-before",
        "object": "urn:hwm:slot:lifecycle-reading-light",
        "claim_ids": ["urn:hwm:claim:old-asset-fulfills-slot"],
        "evidence_record_ids": ["urn:hwm:record:lifecycle-initial-declaration"],
        "extensions": {}
      }],
      "reason_codes": []
    },
    {
      "resolution_id": "urn:hwm:resolution:old-endpoint-before",
      "subject": "urn:hwm:asset:lamp-old",
      "predicate": "hwm-lifecycle:exposes",
      "availability_status": "available",
      "epistemic_status": "accepted",
      "freshness_status": "current",
      "temporal_status": "in_effect",
      "candidates": [{
        "candidate_id": "urn:hwm:candidate:old-endpoint-before",
        "object": "urn:hwm:endpoint:matter-lamp-old",
        "claim_ids": ["urn:hwm:claim:old-asset-exposes-endpoint"],
        "evidence_record_ids": ["urn:hwm:record:lifecycle-initial-declaration"],
        "extensions": {}
      }],
      "reason_codes": []
    },
    {
      "resolution_id": "urn:hwm:resolution:old-effect-before",
      "subject": "urn:hwm:endpoint:matter-lamp-old",
      "predicate": "hwm-effect:predictsOutcome",
      "availability_status": "available",
      "epistemic_status": "accepted",
      "freshness_status": "current",
      "temporal_status": "in_effect",
      "candidates": [{
        "candidate_id": "urn:hwm:candidate:old-effect-before",
        "object": {
          "when": { "action_type": "matter:MoveToLevel", "parameters": { "level_percent": 60 } },
          "affected_feature_id": "urn:hwm:zone:lifecycle-reading",
          "property": "saref:Light",
          "expected_range": { "minimum": 280, "maximum": 315, "unit": "lx" },
          "observation_window_seconds": 10,
          "measurement_procedure": "urn:hwm:procedure:lifecycle-lux-v1",
          "model_version": "old-lamp-v1"
        },
        "claim_ids": ["urn:hwm:claim:old-endpoint-effect"],
        "evidence_record_ids": ["urn:hwm:record:lifecycle-initial-declaration"],
        "extensions": {}
      }],
      "reason_codes": []
    }
  ],
  "conflicts": [],
  "limitations": [],
  "extensions": {}
}
