{
  "contract": "hwm:WorldView",
  "contract_version": "0.1.0",
  "view_id": "urn:hwm:view:before-set-level-60",
  "household_id": "urn:hwm:household:fixture-001",
  "requester": "urn:hwm:subject:planner-agent-001",
  "purpose": "hwm:purpose:reading",
  "generated_at": "2026-07-18T08:05:00Z",
  "as_of": "2026-07-18T08:05:00Z",
  "known_through": "2026-07-18T08:01:00Z",
  "freshness": {
    "maximum_age_seconds": 3600,
    "status": "current"
  },
  "coverage": {
    "entity_refs": [
      "urn:hwm:slot:bedroom-reading-light",
      "urn:hwm:asset:lamp-001",
      "urn:hwm:endpoint:matter-lamp-001",
      "urn:hwm:zone:bedroom-reading",
      "urn:hwm:space:bedroom"
    ],
    "claim_kinds": ["lifecycle", "requirement", "predicted_effect", "occupancy"]
  },
  "authority_epoch": 7,
  "profiles": [
    { "id": "hwm:core", "version": "0.1.0", "required": true },
    { "id": "hwm:space-lifecycle", "version": "0.1.0-fixture", "required": true },
    { "id": "hwm:simple-action-effect", "version": "0.1.0-fixture", "required": true }
  ],
  "resolutions": [
    {
      "resolution_id": "urn:hwm:resolution:functional-slot-type",
      "subject": "urn:hwm:slot:bedroom-reading-light",
      "predicate": "rdf:type",
      "availability_status": "available",
      "epistemic_status": "accepted",
      "freshness_status": "not_applicable",
      "temporal_status": "unbounded",
      "candidates": [
        {
          "candidate_id": "urn:hwm:candidate:functional-slot-type",
          "object": "hwm:FunctionalSlot",
          "claim_ids": ["urn:hwm:claim:functional-slot-type"],
          "evidence_record_ids": ["urn:hwm:record:setup-declaration"],
          "extensions": {}
        }
      ],
      "reason_codes": ["authorized_declaration"]
    },
    {
      "resolution_id": "urn:hwm:resolution:asset-fulfills-slot",
      "subject": "urn:hwm:asset:lamp-001",
      "predicate": "hwm-lifecycle:fulfills",
      "availability_status": "available",
      "epistemic_status": "accepted",
      "freshness_status": "current",
      "temporal_status": "in_effect",
      "candidates": [
        {
          "candidate_id": "urn:hwm:candidate:asset-fulfills-slot",
          "object": "urn:hwm:slot:bedroom-reading-light",
          "claim_ids": ["urn:hwm:claim:asset-fulfills-slot"],
          "evidence_record_ids": ["urn:hwm:record:setup-declaration"],
          "extensions": {}
        }
      ],
      "reason_codes": ["authorized_installer_declaration"]
    },
    {
      "resolution_id": "urn:hwm:resolution:endpoint-exposes-asset",
      "subject": "urn:hwm:asset:lamp-001",
      "predicate": "hwm-lifecycle:exposes",
      "availability_status": "available",
      "epistemic_status": "accepted",
      "freshness_status": "current",
      "temporal_status": "in_effect",
      "candidates": [
        {
          "candidate_id": "urn:hwm:candidate:endpoint-exposes-asset",
          "object": "urn:hwm:endpoint:matter-lamp-001",
          "claim_ids": ["urn:hwm:claim:endpoint-exposes-asset"],
          "evidence_record_ids": ["urn:hwm:record:setup-declaration"],
          "extensions": {}
        }
      ],
      "reason_codes": ["authorized_installer_declaration"]
    },
    {
      "resolution_id": "urn:hwm:resolution:reading-zone-requirement",
      "subject": "urn:hwm:zone:bedroom-reading",
      "predicate": "hwm-effect:minimumRequirement",
      "availability_status": "available",
      "epistemic_status": "accepted",
      "freshness_status": "current",
      "temporal_status": "unbounded",
      "candidates": [
        {
          "candidate_id": "urn:hwm:candidate:reading-zone-requirement",
          "object": {
            "property": "saref:Light",
            "threshold": { "value": 300, "unit": "lx" },
            "comparator": ">="
          },
          "claim_ids": ["urn:hwm:claim:reading-zone-requirement"],
          "evidence_record_ids": ["urn:hwm:record:setup-declaration"],
          "extensions": {}
        }
      ],
      "applicability": {
        "status": "applicable",
        "context_claim_ids": [],
        "conflict_ids": [],
        "reason_codes": ["requested_purpose_is_reading"]
      },
      "reason_codes": ["authorized_household_requirement"]
    },
    {
      "resolution_id": "urn:hwm:resolution:set-level-60-effect",
      "subject": "urn:hwm:endpoint:matter-lamp-001",
      "predicate": "hwm-effect:predictsOutcome",
      "availability_status": "available",
      "epistemic_status": "accepted",
      "freshness_status": "current",
      "temporal_status": "unbounded",
      "candidates": [
        {
          "candidate_id": "urn:hwm:candidate:set-level-60-effect",
          "object": {
            "when": {
              "action_type": "matter:MoveToLevel",
              "parameters": { "level_percent": 60 }
            },
            "affected_feature_id": "urn:hwm:zone:bedroom-reading",
            "property": "saref:Light",
            "expected_range": { "minimum": 285, "maximum": 335, "unit": "lx" },
            "context_claim_ids": [],
            "observation_window_seconds": 10,
            "measurement_procedure": "urn:hwm:procedure:reading-zone-lux-v1",
            "tolerance": { "value": 0, "unit": "lx" },
            "uncertainty": { "kind": "bounded_interval", "confidence": 0.8 },
            "model_version": "commissioning-sample-1"
          },
          "claim_ids": ["urn:hwm:claim:set-level-60-effect"],
          "evidence_record_ids": ["urn:hwm:record:effect-model-declaration"],
          "extensions": {}
        }
      ],
      "reason_codes": ["commissioning_model_in_scope"]
    },
    {
      "resolution_id": "urn:hwm:resolution:bedroom-current-occupancy",
      "subject": "urn:hwm:space:bedroom",
      "predicate": "hwm-presence:currentOccupancy",
      "availability_status": "access_denied",
      "epistemic_status": "not_evaluated",
      "freshness_status": "not_applicable",
      "temporal_status": "indeterminate",
      "candidates": [],
      "reason_codes": ["purpose_not_authorized_for_presence_data"]
    }
  ],
  "conflicts": [],
  "limitations": [
    {
      "code": "fixture_unsigned_records",
      "description": "Fixture Records are unsigned and must not be treated as production trust evidence."
    }
  ],
  "extensions": {}
}
